{
  "schema_version": "3.2.0",
  "validation_id": "validation_2026-04-28_841ac000",
  "proposal_id": "prop_2026-04-28_b3f1a2c4",
  "action_hash": "sha256:6a8d174edc86338a3bd12c8ad6ebc301ba1135c36deb187317dde605a749bc80",
  "validator": {
    "kind": "system",
    "identifier": "approval-validator",
    "authentication": {
      "method": "service_identity",
      "human_present": false,
      "assurance": "high",
      "authenticated_at": "2026-04-28T09:14:24Z"
    }
  },
  "validated_at": "2026-04-28T09:14:24Z",
  "outcome": "passed",
  "checks": [
    {
      "name": "proposal_schema",
      "status": "passed"
    },
    {
      "name": "payload_schema",
      "status": "passed"
    },
    {
      "name": "semantic_preconditions",
      "status": "passed"
    },
    {
      "name": "policy_inputs",
      "status": "passed"
    },
    {
      "name": "authorization_inputs",
      "status": "passed"
    }
  ]
}
